topic,keyword,definition
6-python,Declare,"To introduce a new variable or data structure, often specifying its type."
6-python,File,A collection of data stored on secondary storage.
6-python,Flag,A Boolean variable used to indicate that a certain condition has been met.
6-python,Float,A number with a decimal point; also known as a real number.
6-python,Function,A subprogram that performs a task and returns a value.
6-python,Identifier,"The name of a variable, constant, subprogram or data structure."
6-python,Increment,"Increasing the value of a variable, often by 1."
6-python,Initialise,Giving a variable or data structure its first value.
6-python,Integer,A whole number with no fractional part.
6-python,Iteration,"Repeating a block of code, usually with a loop."
6-python,Library,A collection of pre-written functions and procedures that can be imported into programs.
6-python,List,"A variable-size data structure that can store multiple values, often of mixed types."
6-python,Logic Error,An error where the program runs but does not behave as intended.
6-python,Loop,A structure that repeats a block of code while a condition is met or for a fixed number of times.
6-python,Modulus,An operator that gives the remainder after integer division.
6-python,Nesting,"Putting one programming construct, such as a loop or selection, inside another."
6-python,Operator,"A symbol that tells the program to perform a specific operation, such as + or AND."
6-python,Parameter,A variable in the definition of a subprogram that receives an argument when called.
6-python,Parenthesis,Brackets used to group expressions or to enclose arguments.
6-python,Procedure,A subprogram that performs a task but does not return a value.
6-python,Repetition,A loop that continues until a condition is met.
6-python,Selection,A construct that chooses which code to execute based on conditions.
6-python,Sequence,Executing instructions one after another in a specific order.
6-python,String,Data type used to store text as a sequence of characters.
6-python,Syntax Error,An error where code breaks the rules of the programming language and will not run.
6-python,Real,A number that can have a fractional part; same as a float.
6-python,Return Value,The value a function sends back to the code that called it.
6-python,Run,To start executing a program.
6-python,Subprogram,"A smaller, reusable section of code, such as a function or procedure."
6-python,Variable,A named storage location in memory that can hold a value that may change while the program runs.
1-algorithms,Linear Search,A simple search method that checks each item in a list one by one until the target value is found or the end is reached.
1-algorithms,When Linear Search is Used,Linear search is used when the data is unsorted or small.
1-algorithms,Linear Search Efficiency,It is slow on large lists because every item may need to be checked.
1-algorithms,Binary Search,A search method that repeatedly halves a sorted list to find the target value.
1-algorithms,When Binary Search is Used,Binary search can only be used on lists that are already sorted.
1-algorithms,Binary Search Efficiency,It is more efficient than linear search because it reduces the search space quickly.
1-algorithms,Bubble Sort,A simple sorting algorithm that repeatedly compares and swaps adjacent items until the list is sorted.
1-algorithms,Bubble Sort Efficiency,Bubble sort is slow on large lists because it may require many passes through the data.
1-algorithms,Merge Sort,"A sorting algorithm that splits the list into smaller lists, sorts them, and then merges them back together."
1-algorithms,Merge Sort Method,Uses a divide-and-conquer approach to efficiently sort data.
1-algorithms,Merge Sort Efficiency,It is faster than bubble sort for large lists but uses more memory.
1-algorithms,Algorithm Efficiency,A measure of how quickly an algorithm runs and how much memory it uses.
1-algorithms,Time Complexity (GCSE),A way to compare how the running time of 1-algorithms increases as the input size grows.
1-algorithms,Memory Use,Some 1-algorithms use more memory because they store extra copies of data.
1-algorithms,Efficient Algorithm,An algorithm that completes its task quickly and uses minimal memory.
1-boolean,AND Gate,Outputs 1 only when all inputs are 1.
1-boolean,OR Gate,Outputs 1 when at least one input is 1.
1-boolean,NOT Gate,"Outputs the opposite value of the input (1 becomes 0, and 0 becomes 1)."
1-boolean,Truth Table,A table showing all possible input combinations and the resulting output for a logic gate.